… Deine feine englische Art.,Heinrich VIII.,Redewendung,,
Widerstand ist zwecklos.,Nestlé,Die Borg,,
Widerstand ist zwecklos.,Recep Tayyip Erdoğan zur Presse,Die Borg,,https://www.helpster.de/widerstand-ist-zwecklos-wissenswertes-ueber-star-trek-die-borg_157459
"Willst du den Wert des Geldes kennenlernen, geh und versuche dir welches zu borgen.",Smava GmbH,Benjamin Franklin,,
"Winter, Spring, Summer or fall all you have to do is call, and I’ll be there.",Der Notarzt,Carole King,,
Wir brauchen mehr Wachstum.,Papa Schlumpf,Unbekannt,,halt ein allgemeiner Satz
"Wir hatten zwei Beutel Gras, fünfundsiebzig Kügelchen Meskalin, fünf Löschblattbögen extrastarkes Acid, einen Salzstreuer halbvoll mit Kokain und ein ganzes Spektrum vielfarbiger Upper, Downer, Heuler, Lacher… nicht, dass wir das ganze Zeug für den Trip wirklich brauchten, aber wenn man sich einmal darauf einlässt, eine ernsthafte Drogen-Sammlung anzulegen, neigt man eben dazu, extrem zu werden.",Tinky Winky,Raoul Duke,,
Wir Kommunisten sind alle Tote auf Urlaub.,Lew Dawidowitsch Bronstein,Eugen Leviné,,
Wir Kommunisten sind alle Tote auf Urlaub.,Der Papst,Eugen Leviné,,
Wir lassen uns nicht nervös machen und das geben wir auch nicht zu.,Die Aktienmärkte,Olaf Thon,,
"Wir lieben immer die Menschen, die uns bewundern. Aber nicht immer die, die wir bewundern.",Laura Müller,François VI. de La Rochefoucauld,,
Wir müssen den Kindern mehr Deutsch lernen.,Verein zur Rettung der Deutschen Sprache,Jule Philippi,,
"Wir müssen gewinnen, alles andere ist primär.",Julius Caesar,Hans Krankl,,
"Wir wollen, dass die christlich-abendländische Kultur die Leitkultur bleibt und nicht aufgeht in einem Mischmasch.",DJ Bobo,Edmund Stoiber,,
"Wissen Sie schon, dass man ein weiches Ei nicht als Zahnstocher benutzen soll?",Ein Dozent," Karl Valentin",,
Witz ist wie Kaviar: Er sollte nur in kleinen Bissen genossen werden und nicht dick aufgetragen wie Marmelade.,Anton Schlecker,Noël Coward,,
"Wo die Natur nicht will, ist die Arbeit umsonst.",Thomas Alva Edison,Lucius Annaeus Seneca,Von der Gemütsruhe,
"Wo es den Rednern an Tiefe fehlt, da gehen sie in die Breite.",Fatman,"Charles-Louis de Secondat, Baron de La Brède de Montesquieu",,
"Wo Menschen angebetet werden, ist es gut, sich zu entfernen.",Der Papst,Günther Weisenborn,,
"Wo zwei oder drei in meinem Namen versammelt sind, da bin ich mitten unter ihnen.",Gina Wild,Matthaeus 18:20,,
Wolle mer se reilasse?,Ein Herbergswirt zu seiner Frau im Jahre 4 v. Chr.,Unbekannt,beim Karneval,Nicht eindeutig
Words don’t come easy to me.,Günther Oettinger,F.R. David,,
"Worte sind die mächtigste Droge, welche die Menschheit benutzt.",Kai-Uwe Kling,Rudyard Kipling,,
You talkin’ to me?,Guido Westerwelle auf einer Pressekonferenz,Travis Bickle,,
You’re so fucking special. I wish I was special. But I’m a creep. I’m a weirdo.,Gollum,Radio Head,,
"Zeichnen ist Sprache für die Augen, Sprache ist Malerei für das Ohr.",David Copperfield,Joseph Joubert,,
"Zu 50% stehen wir im Viertelfinale, aber die halbe Miete ist das noch lange nicht.",Teilnehmer der Mathematik-Olympiade (im 8telFinale ausgeschieden),Rudi Völler,,
Zu den Steinen hat einer gesagt: 'Seid menschlich.' Die Steine haben gesagt: 'Wir sind noch nicht hart genug.',Chuck Norris,Erich Fried,,
"Zu mancher richtigen Entscheidung kam es nur, weil der Weg zur Falschen gerade nicht frei war.",Galileo Galilei,Hans Krailsheimer,,
"Zu mancher richtigen Entscheidung kam es nur, weil der Weg zur Falschen gerade nicht frei war.",Gott,Hans Krailsheimer,,
Zuerst hatten wir kein Glück und dann kam auch noch Pech dazu.,Hiob,Jürgen Wegmann,,
Zuerst hatten wir kein Glück und dann kam auch noch Pech dazu.,Paul Sethe,Jürgen Wegmann,,
"Zwei Dinge sind unendlich, das Universum und die menschliche Dummheit, aber bei dem Universum bin ich mir noch nicht ganz sicher.",Claudius Ptolemäus,Albert Einstein,,
"Zwei Dinge sind unendlich, das Universum und die menschliche Dummheit, aber bei dem Universum bin ich mir noch nicht ganz sicher.",Albert Einstein,Albert Einstein,,
"Zwei Dinge sind unendlich, das Universum und die menschliche Dummheit, aber bei dem Universum bin ich mir noch nicht ganz sicher.",Mr. Spock,Albert Einstein,,
Zwei Dinge wird ein Mann niemals verstehen: das Geheimnis der Schöpfung und den Hut einer Frau.,Karl Lagerfeld,Coco Chanel,,
Zwischen zu früh und zu spät liegt immer nur ein Augenblick.,Prince of Persia,Franz Werfe,,